Index,Keyword,Tweets0,Sophia,Thankyou making birthday extra special I 'm blessed sophia I love much 12.20.191,Sophia,Who Sophia Gappola2,Sophia,Can3,Sophia,It passed House without change Senate I guess need4,Sophia,Sometimes get caught end goal forget important enjoy process Every seco5,Sophia,Thankyou making birthday extra special I 'm blessed sophia I love much 12.20.196,Sophia,NAME DROP 1 Chard 2 Chard 3 Ryan 4. twpaper ins bryden 5. mama 6 Heart 7 Sophia 8 Sophia 9 Lst year 's cls7,Sophia,depression n't beautiful fucking aesthetic depression ugly 's raw 's overwhelming 'll leave bed fo8,Sophia,9,Sophia,Tough resilient road win Aztecs Sophia Ramos career-high 30 points Baylee Vanderdoes tied career-hi10,Sophia,Sophia Just Put Me Here Best Song omggggggg11,Sophia,Thnx today12,Sophia,parents used ask permission go13,Sophia,Tough resilient road win Aztecs Sophia Ramos career-high 30 points Baylee Vanderdoes tied career-hi14,Sophia,Have watched recap video Learn challenges experts face everyday fight c15,Sophia,Sophia good someone give hug pls16,Sophia,I 'm honestly becoming desperate see every time I see review17,Sophia,wyatt sophia nation trailer b like18,Sophia,Hello Sophia Happy Friday My friend19,Sophia,The new holiday card Who says Well except maybe Barry ... Jack.. Brick ... Sophia ... Emerson ... Cealey ...20,Sophia,fascinated severe reviews makes nearly want see despite knowing nothing21,Sophia,Loosing dad I 16 one hardest thing go lost mum last night I e22,Sophia,Thanks Thanks another amazing year fighting SOPHIA AIRE 202023,Sophia,Miguel If cash I 'll rubber band You match ... I 'll fuse- Me24,Sophia,fuck impeachment remember north korea said Christmas gift USA25,Sophia,Duck Yells At Own Ass revisited Sophia Grace 201926,Sophia,27,Sophia,sophia tarot please28,Sophia,big head birthday tomorrow I29,Sophia,4 years30,Sophia,I strong enough take things lighter I fighter I raise eyebrows tell troubles Allah enoug31,Sophia,fan Jollibee pero could disagree Jollibee Tala lit NOW I STAN32,Sophia,Mumbai Students interacted Dr. Nagaraj B. got opport33,Sophia,word missing Van Drew `` blue '' state sorry34,Sophia,Duck Yells At Own Ass revisited Sophia Grace 201935,Sophia,Watched black Christmas trailer came Saw Taylor almost cried I mean I watched36,Sophia,Well anyways game I wrote cis trans women finding common cause struggling oppressive37,Sophia,My first gig editor newsletter co-editing Jessica Ordemann amp great team Cassandra En38,Sophia,I 'm Mississippi Democrat Manchin 's case little different He 's actually39,Sophia,Duck Yells At Own Ass revisited Sophia Grace 201940,Sophia,Sophia `` F '' Xodus ON MY OWN41,Sophia,to-be-unfriended challenge CHAR hahahaha42,Sophia,maybe morning I sleep deprived I laughing entrepreneurial one three adjec43,Sophia,Mens RAF Real Fur Shearling Sheepskin Flying Leather Jacket44,Sophia,I jest course45,Sophia,Thanks point exactly Personally I 'm aware brain autopsy Sophia Mirza UK I think br46,Sophia,sleepy vibe47,Sophia,What want us Easy ... Whore bedroom Angel In Kitchen ... ... .. simples48,Sophia,My Fave Interviews 2019 Vanessa Hudgens Hal Linden Mandy Gonzalez Norm Lewis Christian Borle Sophia Ann Ca49,Sophia,Between Kai Loren son Sophia Man Delorean parked man garage man cave someone real